1|1|01/05/2023|04/05/2023|3|Sve se menja
3|2|16/09/2023|21/09/2023|5|Menjaju se prozori
4|4|08/05/2023|11/05/2023|3|Potpuno menjajne svih prozora, menjanje plocica u kupatilu, sudopera popravka, krecenje spavace sobe, krecenje dnevnog boravka, menjanje posudja kao i kupovina novog sporeta
5|8|01/06/2023|03/06/2023|2|Potrebna zamena svih vrata u sobi 203
6|12|15/05/2023|19/05/2023|4|Menjanje prozora
7|12|25/05/2023|04/06/2023|10|Sredjivanje kupatila, menjanje tus kabine, zamena polomljenog ogledala, popravka slavine na lavabou, menjanje svih plocica